{
  "schema_version": 1,
  "id": "c1-04-03::64-26",
  "title": "C1-04-03 - Convocatoria 64/26",
  "kind": "official_call_syllabus",
  "status": "draft",
  "source": {
    "title": "DOGV convocatoria 64/26",
    "url": "https://dogv.gva.es/datos/2026/03/03/pdf/2026_6708_es.pdf",
    "extraction_note": "Estructura mínima extraída del texto de parte general pegado en conversación."
  },
  "blocks": [
    {
      "id": "parte-general",
      "title": "Parte general",
      "items": [
        {
          "id": "A",
          "title": "Constitución",
          "items": [
            {
              "number": 1,
              "title": "La Constitución Española de 1978: Título Preliminar; Título I, De los derechos y deberes fundamentales.",
              "refs": [
                "es-ce-1978::titulo-preliminar",
                "es-ce-1978::titulo-i"
              ]
            },
            {
              "number": 2,
              "title": "La Constitución Española de 1978: Título IV, Del Gobierno y de la Administración; Título V, De las relaciones entre el Gobierno y las Cortes Generales.",
              "refs": [
                "es-ce-1978::titulo-iv",
                "es-ce-1978::titulo-v"
              ]
            }
          ]
        },
        {
          "id": "B",
          "title": "Organización de la Comunitat Valenciana",
          "items": [
            {
              "number": 3,
              "title": "El Estatuto de Autonomía de la Comunitat Valenciana: Título I, Título II, Título III y Título IV.",
              "refs": [
                "es-lo-5-1982::titulo-i",
                "es-lo-5-1982::titulo-ii",
                "es-lo-5-1982::titulo-iii",
                "es-lo-5-1982::titulo-iv"
              ]
            },
            {
              "number": 4,
              "title": "Ley 5/1983, del Consell: Título I; Título II, capítulos I, II, III y VI; Título III.",
              "refs": [
                "es-ley-5-1983::titulo-i",
                "es-ley-5-1983::titulo-ii::capitulo-i",
                "es-ley-5-1983::titulo-ii::capitulo-ii",
                "es-ley-5-1983::titulo-ii::capitulo-iii",
                "es-ley-5-1983::titulo-ii::capitulo-vi",
                "es-ley-5-1983::titulo-iii"
              ]
            },
            {
              "number": 5,
              "title": "Ley 5/1983, del Consell: Título II, capítulos IV y V; Título IV; Título V.",
              "refs": [
                "es-ley-5-1983::titulo-ii::capitulo-iv",
                "es-ley-5-1983::titulo-ii::capitulo-v",
                "es-ley-5-1983::titulo-iv",
                "es-ley-5-1983::titulo-v"
              ]
            }
          ]
        },
        {
          "id": "C",
          "title": "Derecho administrativo",
          "items": [
            {
              "number": 6,
              "title": "Ley 40/2015: Título preliminar, capítulos I y II.",
              "refs": [
                "es-ley-40-2015::titulo-preliminar::capitulo-i",
                "es-ley-40-2015::titulo-preliminar::capitulo-ii"
              ]
            },
            {
              "number": 7,
              "title": "Ley 39/2015: Título preliminar; Título I; Título II; Título III.",
              "refs": [
                "es-ley-39-2015::titulo-preliminar",
                "es-ley-39-2015::titulo-i",
                "es-ley-39-2015::titulo-ii",
                "es-ley-39-2015::titulo-iii"
              ]
            },
            {
              "number": 8,
              "title": "Ley 39/2015: Título IV.",
              "refs": [
                "es-ley-39-2015::titulo-iv"
              ]
            }
          ]
        },
        {
          "id": "D",
          "title": "Función pública",
          "items": [
            {
              "number": 9,
              "title": "Ley 4/2021, de la Función Pública Valenciana: Título I; Título III; Título V; Título VI.",
              "refs": [
                "es-ley-cv-4-2021::titulo-i",
                "es-ley-cv-4-2021::titulo-iii",
                "es-ley-cv-4-2021::titulo-v",
                "es-ley-cv-4-2021::titulo-vi"
              ]
            },
            {
              "number": 10,
              "title": "Decreto 42/2019, de condiciones de trabajo del personal funcionario de la Administración de la Generalitat.",
              "refs": [
                "es-decreto-cv-42-2019"
              ]
            },
            {
              "number": 11,
              "title": "Ley 31/1995, de Prevención de Riesgos Laborales: Capítulo I; Capítulo III.",
              "refs": [
                "es-ley-31-1995::capitulo-i",
                "es-ley-31-1995::capitulo-iii"
              ]
            }
          ]
        },
        {
          "id": "E",
          "title": "Materias transversales",
          "items": [
            {
              "number": 12,
              "title": "Normativa de igualdad, personas trans y LGTBI, y violencia de género incluida en el temario.",
              "refs": [
                "es-lo-3-2007::titulo-preliminar",
                "es-lo-3-2007::titulo-i",
                "es-ley-cv-9-2003",
                "es-ley-4-2023::deber-proteccion",
                "es-ley-4-2023::medidas-ambito-administrativo",
                "es-lo-1-2004::titulo-preliminar"
              ]
            }
          ]
        }
      ]
    }
  ]
}